COLUMNA,DESCRIPCION,TIPO_DATO,LONGITUD,CODIGO_VALIDO
J203A,Total de sueldos al personal administrativo._ contable y de dirección (millones de pesos): Son los pagos que realizó la unidad económica para retribuir el trabajo ordinario y extraordinario del personal dependiente de la razón social._ antes de cualquier deducción retenida por los empleadores (impuesto sobre la renta o sobre el producto del trabajo)._ las aportaciones de los trabajadores a los regímenes de seguridad social (IMSS._ ISSSTE._ INFONAVIT) y las cuotas sindicales. Incluye aguinaldos; comisiones sobre ventas que complementan el sueldo base; primas vacacionales; bonificaciones; incentivos y bonos de productividad. Excluye los gastos en pasajes y viáticos._ alimentación y._ en general._ los gastos reembolsables al trabajador; los pagos al personal que no depende de la unidad económica y que cobra exclusivamente a base de honorarios o comisiones; y los pagos que la unidad económica realiza a otra razón social por concepto de suministro de personal.,Decimal,15._3,0-999999999999999.999
J300A,Contribuciones patronales a regímenes de seguridad social (millones de pesos) : Son todas las aportaciones monetarias que la unidad económica cubrió con sus recursos a instituciones de seguridad social en beneficio de los trabajadores remunerados.,Decimal,15._3,0-999999999999999.999
J400A,Otras prestaciones sociales (millones de pesos): Son los pagos que la unidad económica realizó a instituciones privadas en beneficio de sus trabajadores o que otorgó directamente en especie al personal remunerado._ en complemento o adición a los sueldos y salarios._ tales como servicios médicos privados._ despensas._ primas de seguros._ servicios educativos._ ayudas para estudio y guarderías. Excluye las contribuciones patronales a regímenes de seguridad social._ compra de equipo._ uniformes y ropa de trabajo; costos de capacitación; primas vacacionales; erogaciones para actividades deportivas y recreativas; gastos por concepto de pasajes._ viáticos y alimentación; además de todos aquellos gastos reembolsables al trabajador.,Decimal,15._3,0-999999999999999.999
J500A,Utilidades repartidas a los trabajadores (millones de pesos): Son los pagos en efectivo que la unidad económica distribuyó entre el personal._ antes de cualquier deducción._ por concepto de utilidades._ conforme a la legislación laboral o las cláusulas de los contratos colectivos de trabajo o convenios entre patrones y trabajadores._ cualquiera que sea el ejercicio al que correspondan.,Decimal,15._3,0-999999999999999.999
J600A,Pagos por indemnización o liquidación del personal (millones de pesos): Se refiere a la compensación monetaria que se otorgó a los trabajadores por concepto de despido._ retiro o terminación de contrato laboral con la unidad económica.,Decimal,15._3,0-999999999999999.999
K000A,Total de gastos por consumo de bienes y servicios (millones de pesos) : Es el valor de todos los bienes y servicios consumidos por la unidad económica para realizar sus operaciones el periodo de referencia._ independientemente del periodo en que hayan sido comprados o adquiridos._ considerando el valor de los bienes y servicios que recibió de otros establecimientos de la misma empresa (con o sin costo) para su uso en las actividades de producción u operación de la unidad económica. Incluye el valor de los bienes y servicios que recibió en transferencia para su consumo o transformación y fueron efectivamente consumidos._ en sus actividades productivas o relacionadas con las mismas. Excluye los gastos fiscales._ financieros._ donaciones y los gastos de las empresas o razones sociales controladas por esta empresa.,Decimal,15._3,0-999999999999999.999
K010A,Mercancías y bienes comprados para la reventa (millones de pesos): Es el valor de las mercancías que compró la unidad económica para venderlas en las mismas condiciones en que las adquirió._ así como los gastos realizados por el gas que comercializó con los usuarios. Incluye las mercancías para reventa que recibió de otros establecimientos de la misma empresa. Excluye las mercancías recibidas en consignación.,Decimal,15._3,0-999999999999999.999
K020A,Materiales e insumos consumidos para la prestación de servicios (millones de pesos): Es el importe de los productos y materiales de cualquier especie._ a costo de adquisición._ que fueron consumidos por la unidad económica para proporcionar el servicio que constituye su actividad normal. Incluye los materiales consumidos provenientes de otros establecimientos de la misma empresa. Así como los gastos por servicios de transmisión de energía eléctrica._ gastos por servicios de distribución._ conducción y entrega de gas o productos derivados del petróleo y los gastos del servicio de transporte por ductos proporcionado a terceros.,Decimal,15._3,0-999999999999999.999
K030A,Materias primas y materiales que se integran a la producción (millones de pesos): Es el valor a costo de adquisición en el mercado nacional o extranjero._ de las materias primas y auxiliares consumidas en los procesos de producción; el valor de los materiales consumidos en las obras ejecutadas de manera directa; el valor de los insumos consumidos para la extracción de hidrocarburos; el importe de los agentes o componentes químicos que producen detonaciones._ el valor de los insumos utilizados para el beneficio y precipitación de minerales y para determinar su naturaleza. Así como el valor de los bienes no duraderos consumidos para las actividades pesca o acuicultura.,Decimal,15._3,0-999999999999999.999
K042A,Consumo de combustibles._ lubricantes y energéticos (millones de pesos): Es el importe por consumo en combustibles y lubricantes que realizó la unidad económica para el funcionamiento de la maquinaria._ equipo y los vehículos. Excluye gastos por consumo de energía eléctrica.,Decimal,15._3,0-999999999999999.999
K412A,Gasto por consumo de energía eléctrica (millones de pesos): Es el valor a costo de adquisición que la unidad económica gastó por la utilización de la energía eléctrica; en caso de autogeneración._ impute el costo a precios de mercado.,Decimal,15._3,0-999999999999999.999
K050A,Renta y alquiler de bienes muebles e inmuebles (millones de pesos): Son los gastos por concepto de arrendamiento puro u operativo (arrendamiento no financiero) o alquiler de maquinaria y equipo o bienes inmuebles para el desempeño de las actividades económicas.,Decimal,15._3,0-999999999999999.999
K060A,Contratación de servicios profesionales._ científicos y técnicos (millones de pesos): Comprende los gastos por servicios profesionales._ científicos y técnicos que recibió de consultores independientes y compañías especializadas en temas contables._ legales y de administración._ proyectos de ingeniería técnica y de detalle._ asesoría comercial._ mercadotecnia y servicios relacionados.,Decimal,15._3,0-999999999999999.999
K070A,Maquila y servicios de producción de bienes por contrato (millones de pesos): Son los pagos efectuados por la unidad económica a otra razón social._ por servicios industriales de transformación parcial o total de sus materias primas._ así como el monto que pagó a terceros por la prestación de servicios especializados en una o varias etapas de la producción; los pagos a subcontratistas por la ejecución de una parte de la obra o de la totalidad de los trabajos u obras de construcción._ así como los pagos por los servicios de beneficio de minerales.,Decimal,15._3,0-999999999999999.999
K090A,"Consumo de otros bienes y servicios (millones de pesos).
Son los gastos de operación normal de la unidad económica._ por los bienes y servicios que consumió y que no fueron considerados de manera específica en los conceptos anteriores._ pero están relacionados con la actividad. Incluye: gastos por viáticos._ pasajes y primas de seguros de bienes; la contratación de los servicios de vigilancia._ intendencia._ limpieza._ jardinería._ entre otros; equipo._ uniformes y ropa de trabajo; los costos por selección._ capacitación y administración de personal; los pagos a instructores internos y externos; los materiales de capacitación y los pagos a instituciones de educación (becas); actividades deportivas y recreativas; y otro tipo de materiales y servicios no considerados anteriormente. Excluye: los intereses que pagó por créditos o préstamos._ los impuestos._ las licencias de operación._ los gastos de tipo financiero (pérdidas cambiarias._ pagos de dividendos._ etcétera)._ las deudas incobrables._ las multas._ las donaciones._ la compra y depreciación de los activos fijos.",Decimal,15._3,0-999999999999999.999
K096A,Fletes de productos vendidos (millones de pesos): Comprende los pagos realizados a terceros por los servicios de transporte de productos vendidos._ relacionados únicamente con la manipulación._ recepción._ entrega o distribución de productos._ mercancías y bienes vendidos por la unidad económica._ ya sea mediante transporte terrestre local o foráneo._ aéreo (nacional o internacional) y marítimo.,Decimal,15._3,0-999999999999999.999
K311A,Gastos por consumo de papelería y artículos de oficina (millones de pesos) : Es el valor a costo de adquisición de libretas._ fólderes._ elementos de escritura._ consumibles de computación y en general todos aquellos materiales que se emplean en oficinas y que fueron consumidos por la unidad económica. Incluye los consumidos provenientes de otros establecimientos de la misma empresa.,Decimal,15._3,0-999999999999999.999
K610A,Pagos a otra razón social que contrató y proporcionó personal (millones de pesos) : Son los pagos que realizó la unidad económica a otra razón social que le suministró personal para el desempeño de las actividades productivas y de apoyo. Excluye los pagos por la contratación de servicios._ por ejemplo vigilancia._ intendencia._ limpieza._ jardinería._ entre otros.,Decimal,15._3,0-999999999999999.999
K620A,Gastos por honorarios o comisiones sin sueldo base (millones de pesos) : Es el importe de los gastos que realizó la unidad económica por estos conceptos al personal que no recibe una remuneración base. Excluye las comisiones pagadas en adición a un salario base.,Decimal,15._3,0-999999999999999.999
K810A,Gastos por publicidad (millones de pesos) : Es el valor de los gastos a costo de adquisición que realizó la unidad económica para la difusión y propaganda de sus bienes._ servicios o su imagen pública. Incluye publicidad en radio._ televisión._ Internet._ periódicos y revistas._ los pagos a agencias de publicidad._ la distribución de volantes y calendarios._ plumas y otros artículos publicitarios.,Decimal,15._3,0-999999999999999.999
K820A,Gastos por servicios de comunicación ( millones de pesos) : Es el valor de los gastos a costo de adquisición que realizó la unidad económica por el uso de diversos servicios de telecomunicaciones._ como teléfono._ fax._ Internet y satélite; así como por los servicios de mensajería y correo. Incluye los servicios de acceso a la información en línea.,Decimal,15._3,0-999999999999999.999
K910A,Gastos por cosumo de envases y empaques (millones de pesos) : Es el valor a costo de adquisición de los artículos y materiales de cualquier naturaleza usados para contener._ mejorar la presentación y proteger los productos del maltrato._ descomposición._ daño o merma. Incluye los materiales para producir o armar los envases y empaques._ y los consumidos provenientes de otros establecimientos de la misma empresa. Excluye los enviados a otros establecimientos de la misma empresa.,Decimal,15._3,0-999999999999999.999
K950A,Reparaciones y refacciones para mantenimiento corriente (millones de pesos): Comprende los gastos por servicios de terceros por la reparación y mantenimiento corriente de los activos fijos de la unidad económica._ así como por el consumo de refacciones y partes empleadas en aquellas reparaciones realizadas por el propio establecimiento en los activos fijos de su propiedad. Excluye las partes y refacciones empleadas en la producción o reparaciones mayores de los activos fijos propios.,Decimal,15._3,0-999999999999999.999
K976A,Consumo de agua (millones de pesos): Es el importe por el consumo de agua suministrada por la red municipal o por pipas._ ya sea para el consumo humano o empleada en el proceso productivo.,Decimal,15._3,0-999999999999999.999
M000A,Total de ingresos por suministro de bienes y servicios (millones de pesos): Es el monto que obtuvo la unidad económica durante el periodo de referencia._ por todas aquellas actividades de producción de bienes._ comercialización de mercancías y prestación de servicios. Incluye el valor de los bienes y servicios transferidos a otras unidades económicas de la misma empresa._ más todas las erogaciones o impuestos cobrados al comprador. Excluye los ingresos financieros._ subsidios._ cuotas._ aportaciones y venta de activos fijos.,Decimal,15._3,0-999999999999999.999
M010A,Ingresos por la reventa de mercancías y bienes (millones de pesos): Son los ingresos a valor de venta que obtuvo la unidad económica por la compra-venta de mercancías y bienes en el mismo estado en que los recibió._ así como los ingresos obtenidos por la venta de gas a los usuarios.,Decimal,15._3,0-999999999999999.999
M020A,Ingresos por la prestación de servicios profesionales._ científicos y técnicos (millones de pesos): Son los ingresos a valor de venta que obtuvo la unidad económica por la prestación de sus servicios profesionales o técnicos que constituyen su actividad normal; comprende los ingresos obtenidos por el servicio de transporte de pasajeros._ de carga._ de mensajería y paquetería; el transporte de energía eléctrica; por servicios de distribución y comercialización de gas natural._ el transporte por ductos; por servicios de exploración minera._ así como los obtenidos por servicios de asesoría financiera y de publicidad.,Decimal,15._3,0-999999999999999.999
M030A,Venta de productos elaborados._ generados o extraídos (millones de pesos): Son los ingresos obtenidos por la venta de la producción efectuada durante el periodo o en periodos anteriores. Comprende los ingresos por la venta de energía eléctrica generada._ por el suministro de agua potable para el uso doméstico._ comercial._ industrial y de servicios públicos._ por la venta de agua tratada y la distribución de agua en pipas; los ingresos por la ejecución de obras como contratista principal y subcontratista._ por la administración y supervisión de obras._ por la venta de petróleo crudo._ gas natural y condensados._ por ventas de minerales extraídos y beneficiados._ los minerales extraídos sin beneficio y por la producción pesquera o acuícola.,Decimal,15._3,0-999999999999999.999
M050A,Ingresos por alquiler de bienes muebles e inmuebles (millones de pesos): Son los ingresos a valor de venta por la cesión temporal a otra razón social del derecho de uso o disfrute de los bienes muebles (maquinaria._ equipo._ mobiliario._ etc.) e inmuebles (locales._ terrenos._ edificios._ etc.) de su propiedad.,Decimal,15._3,0-999999999999999.999
M090A,Otros ingresos por suministro de bienes y servicios (millones de pesos): Son los ingresos obtenidos por regalías y servicios de almacenaje._ así como otros conceptos no considerados anteriormente.,Decimal,15._3,0-999999999999999.999
M091A,Otros componentes de la Producción (millones de pesos): Es el valor de los otros componentes de la Producción Bruta Total que complementan la producción._ como las regalías y otros servicios._ incluidos los intereses._ dividendos._ ingresos por cambios y otros ingresos netos de las organizaciones financieras y corporativas.,Decimal,15._3,0-999999999999999.999
M700A,Ingresos por maquilar o transformar materias primas propiedad de terceros (millones de pesos): Son los ingresos obtenidos por la unidad económica por la fabricación._ ensamble u otro tipo de transformación de las materias primas propiedad de terceros. Incluye los ingresos por la transformación de insumos importados temporalmente que fueron transferidos a la unidad económica. Excluye el valor de los insumos consumidos.,Decimal,15._3,0-999999999999999.999
O010A,Valor de productos elaborados._ bienes generados y extraídos (millones de pesos): Es el valor de los bienes que transformó._ procesó o benefició la unidad económica durante el periodo de referencia._ con fines de lucro o no. Incluye la producción defectuosa y los productos maquilados por otra razón social para la unidad económica._ así como el valor de la energía eléctrica generada._ del agua suministrada._ de las obras de construcción realizadas como contratista principal y subcontratista; el valor del petróleo crudo._ del gas natural._ de los condensados._ de los minerales extraídos y beneficiados y de la producción pesquera o acuícola.,Decimal,15._3,0-999999999999999.999
O020A,Activos fijos producidos para uso propio (millones de pesos): Es el valor de la producción de los bienes muebles e inmuebles._ o las mejoras que aumentan su productividad o vida útil. Siempre que hayan sido realizadas por la unidad económica con recursos y personal propios._ para ser utilizados en la producción y operación de la unidad económica. Valorados de acuerdo a la cantidad de materiales y mano de obra utilizada durante el periodo.,Decimal,15._3,0-999999999999999.999
P000A,Total de inventario inicial (millones de pesos) : Es el valor en libros (saldo en el inventario inicial) de los bienes que no habían sido terminados._ consumidos o vendidos._ así como los productos terminados que se encontraban formando parte de sus inventarios en almacén._ lugares de exhibición o venta durante las fechas señaladas._ independientemente del periodo en que hayan sido producidos o adquiridos. Excluye los activos fijos.,Decimal,15._3,0-999999999999999.999
P000B,Total de inventario final (millones de pesos) : Es el valor en libros (saldo en el inventario final) de los bienes que no habían sido terminados._ consumidos o vendidos._ así como los productos terminados que se encontraban formando parte de sus inventarios en almacén._ lugares de exhibición o venta durante las fechas señaladas._ independientemente del periodo en que hayan sido producidos o adquiridos. Excluye los activos fijos.,Decimal,15._3,0-999999999999999.999
P000C,Variación total de existencias (millones de pesos) : Es la diferencia entre el valor en libros._ al final del periodo de estudio._ de los productos terminados._ bienes en proceso de elaboración e insumos propiedad de la unidad económica._ respecto del valor de los productos terminados._ bienes en proceso de elaboración e insumos que tenía al inicio del periodo. Excluye los activos fijos.,Decimal,15._3,0-999999999999999.999
P030A,Total de inventario inicial de productos en proceso (millones de pesos): Es el valor en libros (saldo en el inventario inicial) de los productos que estaban en proceso de producción._ durante las fechas señaladas. Incluye los productos enviados a maquila que no se habían recibido._ los minerales extraídos._ explotados y comprados los que no habían sido beneficiados.,Decimal,15._3,0-999999999999999.999
P030B,Total de inventario final de productos en proceso (millones de pesos): Es el valor en libros (saldo en el inventario final) de los productos que estaban en proceso de producción._ durante las fechas señaladas. Incluye los productos enviados a maquila que no se habían recibido._ los minerales extraídos._ explotados y comprados los que no habían sido beneficiados.,Decimal,15._3,0-999999999999999.999
P030C,Variación de inventarios de productos en proceso (millones de pesos): Es la diferencia entre el valor en libros._ al final del periodo de estudio._ de los productos en proceso de elaboración._ respecto del valor de los bienes en proceso que tenía al inicio del periodo. Excluye los activos fijos.,Decimal,15._3,0-999999999999999.999
P100A,Total de inventario inicial de mercancías compradas para reventa (millones de pesos): Es el valor en libros (saldo en el inventario inicial) de las mercancías compradas para su reventa._ propiedad de la unidad económica._ que se encontraban formando parte de sus inventarios durante las fechas señaladas._ independientemente del periodo en que fueron adquiridas. Incluye las mercancías compradas para su reventa que no habían sido vendidas y que fueron enviadas a terceros para su venta a consignación; así como las que se recibieron de otras unidades económicas de la misma empresa. Excluye las mercancías que se recibieron en consignación y aún no se vendían._ y las que se mandaron a otras unidades económicas de la misma empresa.,Decimal,15._3,0-999999999999999.999
P100B,Total de inventario final de mercancías compradas para reventa (millones de pesos): Es el valor en libros (saldo en el inventario final) de las mercancías compradas para su reventa._ propiedad de la unidad económica._ que se encontraban formando parte de sus inventarios durante las fechas señaladas._ independientemente del periodo en que fueron adquiridas. Incluye las mercancías compradas para su reventa que no habían sido vendidas y que fueron enviadas a terceros para su venta a consignación; así como las que se recibieron de otras unidades económicas de la misma empresa. Excluye las mercancías que se recibieron en consignación y aún no se vendían._ y las que se mandaron a otras unidades económicas de la misma empresa.,Decimal,15._3,0-999999999999999.999
Q000A,Acervo total de activos fijos (millones de pesos): Es el valor actualizado de todos aquellos bienes._ propiedad de la unidad económica –cuya vida útil es superior a un año– que tienen la capacidad de producir o proporcionar las condiciones necesarias para la generación de bienes y servicios. Incluye los activos fijos propiedad de la unidad económica alquilados a terceros; los que utiliza normalmente._ aun cuando sean asignados temporalmente a otras unidades económicas de la misma empresa; los que produce de la unidad económica para uso propio y los activos fijos que obtuvo en arrendamiento financiero. Excluye los activos fijos que utilizan normalmente otras unidades económicas de la misma empresa; los activos fijos en arrendamiento puro; las reparaciones menores de los activos fijos; los gastos por reparación y mantenimiento corriente.,Decimal,15._3,0-999999999999999.999
Q000B,Depreciación total de activos fijos (millones de pesos) : Comprende la pérdida de valor durante el periodo de referencia._ por el uso u obsolescencia de los activos fijos propiedad de la unidad económica.,Decimal,15._3,0-999999999999999.999
Q000C,Compras totales de activos fijos (millones de pesos) : Es el monto de las adquisiciones y transferencias recibidas de activos fijos a valor actual._ nuevos o usados._ que durante el periodo de referencia realizó la unidad económica._ sumando todas las erogaciones en que incurrió para llevar e instalar los activos fijos en la unidad económica y su puesta en funcionamiento. Incluye las mejoras._ reformas y renovaciones de importancia que realizó la unidad económica en sus activos fijos para incrementar la productividad o vida útil de éstos y la producción de activos fijos para uso propio. Excluye las reparaciones y mantenimiento corriente de los activos fijos.,Decimal,15._3,0-999999999999999.999
Q000D,Ventas totales de activos fijos (millones de pesos): Es el monto de las ventas realizadas durante el periodo de referencia._ de los activos fijos que fueron propiedad de la unidad económica.,Decimal,15._3,0-999999999999999.999
Q010A,Acervo total de maquinaria y equipo de producción (millones de pesos) : Es el valor actualizado o a costo de reposición el día 31 de diciembre del periodo de referencia._ de la maquinaria y el equipo mecánico._ eléctrico._ computarizado o de otro tipo._ propiedad de la unidad económica._ vinculado directamente con sus procesos de producción._ comercialización o prestación de servicios y tareas auxiliares._ así como el equipo para el servicio de transporte de pasajeros y carga._ la construcción._ la explotación y extracción de minerales._ embarcaciones._ artes y equipo para la pesca y la acuicultura.,Decimal,15._3,0-999999999999999.999
Q020A,Acervo total de bienes inmuebles (millones de pesos) : Es el valor actualizado a costo de reposición el día 31 de diciembre del periodo de referencia._ de los edificios._ locales._ construcciones e instalaciones como pozos y plataformas marinas._ ductos._ estructuras y equipo de compresión._ regulación y medición de hidrocarburos._ de telecomunicaciones y otras construcciones._ como plantas de tratamiento._ obras de toma._ líneas de conducción._ propiedad de la unidad económica._ que utilizó para el desarrollo de sus actividades; así como las áreas para estacionamiento._ esparcimiento._ áreas verdes._ entre otras. Incluye el valor de los terrenos._ estén o no edificados._ situados en la misma ubicación física de la unidad económica.,Decimal,15._3,0-999999999999999.999
Q030A,Acervo total de unidades y equipo de transporte (millones de pesos): Es el valor actualizado a costo de reposición el día 31 de diciembre del periodo de referencia._ del equipo de transporte (vehículos automotores._ aviones._ barcos._ etcétera) propiedad de la unidad económica._ que utilizó para transportar personas o carga fuera de la misma. Excluye el equipo necesario para transportar o levantar carga dentro de la unidad económica.,Decimal,15._3,0-999999999999999.999
